{"elecciones":[{"anio":2009,"lista_nominal":392257,"participacion":0.33,"por_edad":{"18-24":0.224,"25-34":0.248,"35-44":0.346,"45-59":0.449,"60+":0.452},"por_sexo":{"H":0.314,"M":0.348},"tipo":"intermedia"},{"anio":2012,"lista_nominal":414778,"participacion":0.57,"por_edad":{"18-24":0.454,"25-34":0.488,"35-44":0.597,"45-59":0.684,"60+":0.678},"por_sexo":{"H":0.531,"M":0.613},"tipo":"presidencial"},{"anio":2015,"lista_nominal":465376,"participacion":0.514,"por_edad":{"18-24":0.395,"25-34":0.413,"35-44":0.534,"45-59":0.629,"60+":0.638},"por_sexo":{"H":0.47,"M":0.56},"tipo":"intermedia"},{"anio":2018,"lista_nominal":516152,"participacion":0.562,"por_edad":{"18-24":0.444,"25-34":0.481,"35-44":0.582,"45-59":0.655,"60+":0.659},"por_sexo":{"H":0.527,"M":0.599},"tipo":"presidencial"},{"anio":2021,"lista_nominal":561667,"participacion":0.479,"por_edad":{"18-24":0.371,"25-34":0.369,"35-44":0.474,"45-59":0.578,"60+":0.624},"por_sexo":{"H":0.448,"M":0.512},"tipo":"intermedia"},{"anio":2024,"lista_nominal":613613,"participacion":0.531,"por_edad":{"18-24":0.402,"25-34":0.428,"35-44":0.524,"45-59":0.618,"60+":0.685},"por_sexo":{"H":0.495,"M":0.567},"tipo":"presidencial"}],"fuente":"INE · CCPC","municipios":[{"archivo":"municipio/baja-california-sur/03001_comondu.json","cve":1,"cvegeo":"03001","estado_resolucion":"equivalencia_verificada","id_operativo":"cvegeo:03001","identidad_verificada":true,"nombre":"Comondú","participacion":{"2009":0.379,"2012":0.621,"2015":0.608,"2018":0.598,"2021":0.564,"2024":0.494},"suprimido":false},{"archivo":"municipio/baja-california-sur/03003_la-paz.json","cve":3,"cvegeo":"03003","estado_resolucion":"equivalencia_verificada","id_operativo":"cvegeo:03003","identidad_verificada":true,"nombre":"La Paz","participacion":{"2009":0.343,"2012":0.609,"2015":0.541,"2018":0.593,"2021":0.514,"2024":0.556},"suprimido":false},{"archivo":"municipio/baja-california-sur/03009_loreto.json","cve":5,"cvegeo":"03009","estado_resolucion":"candidato_inequivoco","id_operativo":"candidato_inegi:03009","identidad_verificada":true,"nombre":"Loreto","participacion":{"2009":0.432,"2012":0.63,"2015":0.717,"2018":0.67,"2021":0.609,"2024":0.678},"suprimido":false},{"archivo":"municipio/baja-california-sur/03008_los-cabos.json","cve":4,"cvegeo":"03008","estado_resolucion":"candidato_inequivoco","id_operativo":"candidato_inegi:03008","identidad_verificada":true,"nombre":"Los Cabos","participacion":{"2009":0.279,"2012":0.503,"2015":0.435,"2018":0.511,"2021":0.411,"2024":0.504},"suprimido":false},{"archivo":"municipio/baja-california-sur/03002_mulege.json","cve":2,"cvegeo":"03002","estado_resolucion":"equivalencia_verificada","id_operativo":"cvegeo:03002","identidad_verificada":true,"nombre":"Mulegé","participacion":{"2009":0.373,"2012":0.579,"2015":0.578,"2018":0.589,"2021":0.536,"2024":0.558},"suprimido":false}],"perfil_estatal":{"anios":[2009,2012,2015,2018,2021,2024],"efecto_presidencial_pp":-2.379,"metodologia":"perfil_descriptivo_estatal_v1","nivel_pp":-4.746,"referencia":"participacion_nacional_desde_conteos","tendencia_pp_decada":2.31,"volatilidad_pp":6.09},"territorio":{"cve":3,"cveEntidad":3,"nivel":"entidad","nombre":"BAJA CALIFORNIA SUR"},"votos_esperados_por_edad":{"18-24":1.218,"25-34":1.278,"35-44":1.58,"45-59":1.852,"60+":1.967}}